{
  "$schema": "https://tinyzkp.com/schemas/tinyzkp-changelog.schema.json",
  "name": "TinyZKP Changelog and Release Policy",
  "url": "https://tinyzkp.com/changelog",
  "generated_at": "2026-06-24",
  "summary": "Public release notes, compatibility rules, and release identity metadata for TinyZKP proof receipts, API, MCP, verifier, pricing, evaluation, schemas, and public product metadata.",
  "current_public_release": {
    "id": "public-metadata-2026-06-24",
    "date": "2026-06-24",
    "status": "current",
    "theme": "Proof receipts for agents, APIs, and state transitions",
    "product_boundary": "Transparent STARK state-transition proof receipts for supported public templates. Generic private-input zero knowledge, arbitrary zkVM execution, zkML, and chain-specific on-chain verification are not default self-serve claims.",
    "surfaces": [
      "website",
      "OpenAPI",
      "MCP metadata",
      "server-card discovery",
      "agent policy metadata",
      "proof template catalog",
      "examples metadata",
      "limits metadata",
      "fit finder metadata",
      "evaluation metadata",
      "ROI business-case metadata",
      "pricing metadata",
      "calculator metadata",
      "discovery metadata",
      "agent platform pages",
      "platform rollout offer",
      "comparison pages",
      "receipt schemas",
      "browser verifier guidance"
    ],
    "highlights": [
      "Published buyer-facing hubs for use cases, comparisons, integrations, proof templates, examples, limits, evaluation, pricing, calculator, and pilot review.",
      "Added machine-readable metadata for MCP tools, MCP marketplace discovery, agent proof policy, integrations, templates, examples, limits, fit finder, evaluation, pricing, calculator guidance, OpenAPI, and schemas.",
      "Added GTM pages for agent platforms, verifiable agent output, and agent audit trails, plus comparison pages for zkVM provers, zkTLS, and blockchain anchoring.",
      "Added commercial packaging for a $5,000 creditable production pilot, a dedicated platform-rollout package from $499/month minimum plus usage, and reserved-capacity review.",
      "Added ROI and business-case worksheet for finance/procurement review, avoided-cost modeling, and pilot payback.",
      "Added Fit Finder for routing buyers and agents between Free, Developer, Pro, Scale, Compute, paid pilot, platform rollout, enterprise, and defer paths.",
      "Clarified that the live self-serve product is a transparent STARK state-transition receipt, not a generic private-input ZK service by default.",
      "Documented release identity endpoints for checking deploy skew across website, API, MCP, SDK examples, and verifier behavior.",
      "Added public release policy guidance for API, MCP, templates, examples, verifier, schemas, evaluation, pricing, calculator, and security surfaces."
    ],
    "compatibility_notes": [
      "New response fields are additive by default; clients should ignore fields they do not understand.",
      "Route removals, required-parameter changes, proof-format floors, and verifier acceptance changes require a migration note before public rollout unless the change is an emergency security disablement.",
      "Template lifecycle changes must update /templates.json and should not present preview or review-gated templates as generally available.",
      "Pricing changes must update /pricing.json and /calculator.json before they are treated as buyer-facing source of truth.",
      "MCP tool changes must update /mcp.json and /.well-known/mcp/server-card.json when they affect discovery, installation, tool names, auth expectations, or response semantics."
    ]
  },
  "release_policy": {
    "additive_changes": [
      "New optional API response fields",
      "New metadata links",
      "New examples",
      "New gated proof templates",
      "New read-only MCP tools",
      "New agent proof policy guidance",
      "Clearer pricing or trust guidance"
    ],
    "breaking_or_sensitive_changes": [
      "Route removal",
      "Required-parameter change",
      "Proof-format floor or verifier acceptance change",
      "MCP tool removal or input-shape change",
      "Agent proof policy requirement change",
      "Template statement change",
      "Billing-event definition or rate change",
      "Material trust, data-handling, or audit-status change"
    ],
    "normal_requirements": [
      "Publish a changelog entry",
      "Update the relevant machine-readable metadata file",
      "Update the public schema when the file shape changes",
      "Include migration guidance for breaking or sensitive changes",
      "Expose release identity for website, API, and MCP surfaces where applicable"
    ],
    "emergency_exception": "Security disables or abuse-mitigation changes may ship before the normal deprecation window, with a public note added as soon as practical."
  },
  "surface_policy": [
    {
      "surface": "API and OpenAPI",
      "metadata": "https://tinyzkp.com/openapi.json",
      "breaking_change_examples": [
        "Route removal",
        "Required request-field change",
        "Verifier acceptance change",
        "Proof-format floor"
      ],
      "required_artifacts": [
        "Changelog entry",
        "Migration note",
        "OpenAPI update",
        "Version endpoint check"
      ]
    },
    {
      "surface": "MCP tools",
      "metadata": "https://tinyzkp.com/mcp.json",
      "breaking_change_examples": [
        "Tool removal",
        "Auth expectation change",
        "Input-shape change",
        "Semantic change to proving or verification"
      ],
      "required_artifacts": [
        "MCP metadata update",
        "Server-card update",
        "Changelog note",
        "Install guidance"
      ]
    },
    {
      "surface": "Agent proof policy",
      "metadata": "https://tinyzkp.com/agent-policy.json",
      "breaking_change_examples": [
        "Changed mint-or-skip rule",
        "Changed verification requirement",
        "Changed transparent-parameter guardrail",
        "Changed escalation trigger"
      ],
      "required_artifacts": [
        "Agent policy metadata update",
        "MCP or agent receipt schema update where applicable",
        "Changelog note"
      ]
    },
    {
      "surface": "Proof templates",
      "metadata": "https://tinyzkp.com/templates.json",
      "breaking_change_examples": [
        "Template retirement",
        "Changed public statement",
        "Changed accepted parameters",
        "Changed verifier path"
      ],
      "required_artifacts": [
        "Template catalog update",
        "Lifecycle update",
        "Migration guidance"
      ]
    },
    {
      "surface": "Examples and sample workflows",
      "metadata": "https://tinyzkp.com/examples.json",
      "breaking_change_examples": [
        "Changed sample statement boundary",
        "Removed an example workflow",
        "Changed generated playground parameters",
        "Changed what an example claims to prove"
      ],
      "required_artifacts": [
        "Examples metadata update",
        "Template or receipt boundary update where applicable",
        "Changelog note"
      ]
    },
    {
      "surface": "Limits and capabilities",
      "metadata": "https://tinyzkp.com/limits.json",
      "breaking_change_examples": [
        "Plan throughput or concurrency limit change",
        "Anonymous demo cap change",
        "Changed supported capability boundary",
        "Changed escalation trigger for production workflows"
      ],
      "required_artifacts": [
        "Limits metadata update",
        "Pricing or template metadata update where applicable",
        "Changelog note"
      ]
    },
    {
      "surface": "Pricing and calculator",
      "metadata": "https://tinyzkp.com/pricing.json",
      "breaking_change_examples": [
        "Rate change",
        "Plan cap change",
        "Billing-event definition change",
        "Compute formula change"
      ],
      "required_artifacts": [
        "Pricing metadata update",
        "Calculator metadata update",
        "Changelog note"
      ]
    },
    {
      "surface": "Evaluation and rollout planning",
      "metadata": "https://tinyzkp.com/evaluation.json",
      "breaking_change_examples": [
        "Changed go/no-go guidance",
        "Changed recommended buying path",
        "Changed stakeholder evidence requirements",
        "Changed default product-fit criteria"
      ],
      "required_artifacts": [
        "Evaluation metadata update",
        "Trust or pricing links where applicable",
        "Changelog note"
      ]
    },
    {
      "surface": "Security status",
      "metadata": "https://tinyzkp.com/discovery.json",
      "breaking_change_examples": [
        "Audit-status change",
        "Material incident disclosure",
        "Data-retention change",
        "Product-scope change"
      ],
      "required_artifacts": [
        "Security status update",
        "Security page update",
        "Status or incident link where applicable"
      ]
    }
  ],
  "release_identity": {
    "website": "https://tinyzkp.com/api/release",
    "api": "https://api.tinyzkp.com/version",
    "mcp": "https://mcp.tinyzkp.com/version",
    "canonical_openapi": "https://api.tinyzkp.com/api-doc/openapi.json",
    "marketing_openapi": "https://tinyzkp.com/openapi.json"
  },
  "links": {
    "changelog": "https://tinyzkp.com/changelog",
    "changelog_metadata": "https://tinyzkp.com/changelog.json",
    "changelog_schema": "https://tinyzkp.com/schemas/tinyzkp-changelog.schema.json",
    "docs_versioning": "https://tinyzkp.com/docs#versioning-deprecation",
    "security_status": "https://tinyzkp.com/security",
    "security_review": "https://tinyzkp.com/security",
    "status": "https://tinyzkp.com/status",
    "openapi": "https://tinyzkp.com/openapi.json",
    "mcp_metadata": "https://tinyzkp.com/mcp.json",